{
  "schema_version": 1,
  "rewind_id": "2025-26",
  "massif_id": "pyrenees",
  "start": "2025-12-01",
  "end": "2026-05-01",
  "generated_at": "2026-10-04T11:50:13Z",
  "timezone": "Europe/Paris",
  "stations": {
    "font-romeu": {
      "id": "font-romeu",
      "name": "Font-Romeu Pyrénées 2000",
      "short_name": "Font-Romeu",
      "lat": 42.515,
      "lon": 2.01,
      "elevation": {
        "base": 1750,
        "mid": 1980,
        "summit": 2213
      },
      "aspects": [
        "N",
        "NE",
        "E"
      ],
      "website": null
    },
    "les-angles": {
      "id": "les-angles",
      "name": "Les Angles",
      "short_name": "Les Angles",
      "lat": 42.57,
      "lon": 2.05,
      "elevation": {
        "base": 1600,
        "mid": 2000,
        "summit": 2400
      },
      "aspects": [
        "N",
        "NE",
        "E"
      ],
      "website": null
    },
    "formigueres": {
      "id": "formigueres",
      "name": "Formiguères",
      "short_name": "Formiguères",
      "lat": 42.62,
      "lon": 2.055,
      "elevation": {
        "base": 1700,
        "mid": 2020,
        "summit": 2350
      },
      "aspects": [
        "NE",
        "E"
      ],
      "website": null
    },
    "porte-puymorens": {
      "id": "porte-puymorens",
      "name": "Porté-Puymorens",
      "short_name": "Porté",
      "lat": 42.553,
      "lon": 1.815,
      "elevation": {
        "base": 1600,
        "mid": 2050,
        "summit": 2500
      },
      "aspects": [
        "N",
        "NW",
        "W"
      ],
      "website": null
    },
    "ax-3-domaines": {
      "id": "ax-3-domaines",
      "name": "Ax 3 Domaines",
      "short_name": "Ax 3 Domaines",
      "lat": 42.685,
      "lon": 1.795,
      "elevation": {
        "base": 1400,
        "mid": 1900,
        "summit": 2400
      },
      "aspects": [
        "N",
        "NE"
      ],
      "website": null
    },
    "ascou-pailheres": {
      "id": "ascou-pailheres",
      "name": "Ascou-Pailhères",
      "short_name": "Ascou",
      "lat": 42.74,
      "lon": 1.9,
      "elevation": {
        "base": 1500,
        "mid": 1760,
        "summit": 2030
      },
      "aspects": [
        "N"
      ],
      "website": null
    },
    "guzet": {
      "id": "guzet",
      "name": "Guzet",
      "short_name": "Guzet",
      "lat": 42.788,
      "lon": 1.3,
      "elevation": {
        "base": 1100,
        "mid": 1600,
        "summit": 2100
      },
      "aspects": [
        "N",
        "NW"
      ],
      "website": null
    },
    "le-mourtis": {
      "id": "le-mourtis",
      "name": "Le Mourtis",
      "short_name": "Le Mourtis",
      "lat": 42.877,
      "lon": 0.77,
      "elevation": {
        "base": 1380,
        "mid": 1620,
        "summit": 1860
      },
      "aspects": [
        "N",
        "NE"
      ],
      "website": null
    },
    "peyragudes": {
      "id": "peyragudes",
      "name": "Peyragudes",
      "short_name": "Peyragudes",
      "lat": 42.795,
      "lon": 0.455,
      "elevation": {
        "base": 1600,
        "mid": 2000,
        "summit": 2400
      },
      "aspects": [
        "N",
        "E",
        "W"
      ],
      "website": null
    },
    "saint-lary": {
      "id": "saint-lary",
      "name": "Saint-Lary",
      "short_name": "Saint-Lary",
      "lat": 42.8,
      "lon": 0.322,
      "elevation": {
        "base": 1700,
        "mid": 2110,
        "summit": 2515
      },
      "aspects": [
        "N",
        "NE",
        "E"
      ],
      "website": null
    },
    "piau-engaly": {
      "id": "piau-engaly",
      "name": "Piau-Engaly",
      "short_name": "Piau",
      "lat": 42.788,
      "lon": 0.158,
      "elevation": {
        "base": 1420,
        "mid": 2010,
        "summit": 2600
      },
      "aspects": [
        "N",
        "NE"
      ],
      "website": null
    },
    "val-louron": {
      "id": "val-louron",
      "name": "Val Louron",
      "short_name": "Val Louron",
      "lat": 42.807,
      "lon": 0.413,
      "elevation": {
        "base": 1450,
        "mid": 1800,
        "summit": 2150
      },
      "aspects": [
        "N",
        "E"
      ],
      "website": null
    },
    "grand-tourmalet": {
      "id": "grand-tourmalet",
      "name": "Grand Tourmalet",
      "short_name": "Tourmalet",
      "lat": 42.91,
      "lon": 0.18,
      "elevation": {
        "base": 1400,
        "mid": 1950,
        "summit": 2500
      },
      "aspects": [
        "N",
        "E",
        "S"
      ],
      "website": null
    },
    "luz-ardiden": {
      "id": "luz-ardiden",
      "name": "Luz Ardiden",
      "short_name": "Luz Ardiden",
      "lat": 42.876,
      "lon": -0.07,
      "elevation": {
        "base": 1680,
        "mid": 2090,
        "summit": 2500
      },
      "aspects": [
        "N",
        "E"
      ],
      "website": null
    },
    "cauterets": {
      "id": "cauterets",
      "name": "Cauterets – Cirque du Lys",
      "short_name": "Cauterets",
      "lat": 42.866,
      "lon": -0.145,
      "elevation": {
        "base": 1850,
        "mid": 2130,
        "summit": 2415
      },
      "aspects": [
        "N",
        "NE"
      ],
      "website": null
    },
    "gourette": {
      "id": "gourette",
      "name": "Gourette",
      "short_name": "Gourette",
      "lat": 42.957,
      "lon": -0.333,
      "elevation": {
        "base": 1400,
        "mid": 1900,
        "summit": 2400
      },
      "aspects": [
        "N",
        "E",
        "W"
      ],
      "website": null
    },
    "la-pierre-saint-martin": {
      "id": "la-pierre-saint-martin",
      "name": "La Pierre Saint-Martin",
      "short_name": "La Pierre St-Martin",
      "lat": 42.978,
      "lon": -0.757,
      "elevation": {
        "base": 1450,
        "mid": 1820,
        "summit": 2200
      },
      "aspects": [
        "N",
        "NE"
      ],
      "website": null
    },
    "superbagneres": {
      "id": "superbagneres",
      "name": "Luchon-Superbagnères",
      "short_name": "Superbagnères",
      "lat": 42.757,
      "lon": 0.58,
      "elevation": {
        "base": 1440,
        "mid": 1850,
        "summit": 2260
      },
      "aspects": [
        "N",
        "E",
        "W"
      ],
      "website": null
    }
  },
  "kpis": {
    "season_total_snowfall": {
      "kpi_id": "season_total_snowfall",
      "aggregator_version": "1",
      "unit": "m",
      "ranking": [
        {
          "station_id": "la-pierre-saint-martin",
          "value": 4.434,
          "drivers": {
            "best_day": "2026-02-14",
            "best_day_cm": 33.9,
            "snow_days": 52
          }
        },
        {
          "station_id": "grand-tourmalet",
          "value": 2.586,
          "drivers": {
            "best_day": "2026-02-14",
            "best_day_cm": 23.7,
            "snow_days": 39
          }
        },
        {
          "station_id": "formigueres",
          "value": 2.449,
          "drivers": {
            "best_day": "2026-02-14",
            "best_day_cm": 22.3,
            "snow_days": 43
          }
        },
        {
          "station_id": "gourette",
          "value": 2.34,
          "drivers": {
            "best_day": "2026-02-14",
            "best_day_cm": 16.8,
            "snow_days": 35
          }
        },
        {
          "station_id": "ascou-pailheres",
          "value": 2.293,
          "drivers": {
            "best_day": "2026-01-10",
            "best_day_cm": 16.7,
            "snow_days": 37
          }
        },
        {
          "station_id": "porte-puymorens",
          "value": 2.227,
          "drivers": {
            "best_day": "2026-02-14",
            "best_day_cm": 21.6,
            "snow_days": 38
          }
        },
        {
          "station_id": "cauterets",
          "value": 1.966,
          "drivers": {
            "best_day": "2026-02-14",
            "best_day_cm": 24.5,
            "snow_days": 34
          }
        },
        {
          "station_id": "ax-3-domaines",
          "value": 1.926,
          "drivers": {
            "best_day": "2026-02-14",
            "best_day_cm": 19.9,
            "snow_days": 32
          }
        },
        {
          "station_id": "les-angles",
          "value": 1.725,
          "drivers": {
            "best_day": "2026-01-10",
            "best_day_cm": 12.9,
            "snow_days": 34
          }
        },
        {
          "station_id": "luz-ardiden",
          "value": 1.719,
          "drivers": {
            "best_day": "2026-02-14",
            "best_day_cm": 14.1,
            "snow_days": 32
          }
        },
        {
          "station_id": "piau-engaly",
          "value": 1.557,
          "drivers": {
            "best_day": "2026-01-17",
            "best_day_cm": 14.2,
            "snow_days": 37
          }
        },
        {
          "station_id": "peyragudes",
          "value": 1.471,
          "drivers": {
            "best_day": "2026-02-14",
            "best_day_cm": 19.5,
            "snow_days": 29
          }
        },
        {
          "station_id": "guzet",
          "value": 1.316,
          "drivers": {
            "best_day": "2026-01-24",
            "best_day_cm": 14.0,
            "snow_days": 28
          }
        },
        {
          "station_id": "le-mourtis",
          "value": 1.162,
          "drivers": {
            "best_day": "2026-02-14",
            "best_day_cm": 17.1,
            "snow_days": 26
          }
        },
        {
          "station_id": "font-romeu",
          "value": 0.912,
          "drivers": {
            "best_day": "2026-01-10",
            "best_day_cm": 9.1,
            "snow_days": 21
          }
        },
        {
          "station_id": "saint-lary",
          "value": 0.647,
          "drivers": {
            "best_day": "2026-02-14",
            "best_day_cm": 7.4,
            "snow_days": 18
          }
        },
        {